demonstration	demon_label
And the number of stocks hitting new lows far outstrips the number setting new highs	And the number of stocks far outstrips the number setting new highs
One ad features a huge robot carrying a voluptuous woman in a faint	One ad features a huge robot
One of the two British companies still making hard toilet paper stopped production of it	One of the two British companies stopped production of it
Now it is their fellow Turks arriving as refugees from Bulgaria	Now it is their fellow Turks
Some equipment going to work is almost new	Some equipment is almost new
It arrived just as the regulator handling such operations was retiring	It arrived just as the regulator was retiring
Institutional buyers were the main force pushing blue chips higher	Institutional buyers were the main force
The same factors limiting demand for office space have affected retailing	The same factors have affected retailing
Some equipment going to work is almost new	Some equipment going to is almost new
Nerds and geeks sometimes find themselves a bit isolated at Harvard	Nerds and geeks sometimes find themselves isolated at Harvard
It has more drug users than Boston has people	It has more drug users
Nguyen Van Chan is living proof that old ways die hard	Nguyen Van Chan is living proof
But there is no solid evidence that the Khmer Rouge have changed	But there is no solid evidence
The stock market is certainly not too big for the Fed to handle	The stock market is certainly not too big
But the device obscures more than it illuminates	But the device obscures more
More carefully targeted intervention might actually reduce the need for government action	targeted intervention might actually reduce the need for government action
Poverty remains far more widespread among blacks than other Americans	Poverty remains widespread among blacks than other Americans
Trading volume was only modestly higher than normal	Trading volume was higher than normal
And transfer control of much of it to Capitol Hill	And
Several other Japanese companies and regional governments have sent aid to San Francisco	Several other Japanese have sent aid to San Francisco
The pool invested idle cash for many state agencies and local governments	The pool invested idle cash for many
No lawyers or tape recorders were present	No were present
Several other Japanese companies and regional governments have sent aid to San Francisco	Several other Japanese and regional governments have sent aid to San Francisco
Several other Japanese companies and regional governments have sent aid to San Francisco	Several other Japanese companies and have sent aid to San Francisco
The pool invested idle cash for many state agencies and local governments	The pool invested idle cash for many and local governments
The pool invested idle cash for many state agencies and local governments	The pool invested idle cash for many state agencies and
No lawyers or tape recorders were present	No or tape recorders were present
No lawyers or tape recorders were present	No lawyers or were present
But attendance is down from previous years	But attendance is down
He was back in jail over the summer on shoplifting charges	He was back over the summer on shoplifting charges
Foreign auto makers are taking the Tokyo Motor Show more seriously than ever	Foreign auto makers are taking the Tokyo Motor Show more seriously
Bonds received a bigger boost later in the day when stock prices moved broadly lower	Bonds received a bigger boost later when stock prices moved broadly lower
Some industry groups consistently weather the storm better than others	Some industry groups consistently weather the storm better
Steppenwolf needs the extra seats even more than the fly space	Steppenwolf needs the extra seats even more
Measures of manufacturing activity fell more than the overall measures	Measures of manufacturing activity fell more
The biggest flurry of investor activity came early in the day	The biggest flurry of investor activity came early
Buyers stepped in to the futures pit	Buyers stepped in
Foreign auto makers are taking the Tokyo Motor Show more seriously than ever	Foreign auto makers are taking the Tokyo Motor Show than ever
Steppenwolf needs the extra seats even more than the fly space	Steppenwolf needs the extra seats than the fly space
Measures of manufacturing activity fell more than the overall measures	Measures of manufacturing activity fell than the overall measures
He ticks off several major differences between now and two years ago	He ticks off several major differences between and two years ago
He ticks off several major differences between now and two years ago	He ticks off several major differences between now and
The company is active in office and residential development in New York	The company is active in development in New York
The deal requires regulatory and shareholder approval	The deal requires approval
Hanson is a London producer of consumer and other goods	Hanson is a London producer of goods
Only now is it undergoing a badly needed facelift	is it undergoing a badly needed facelift
Never once did she gasp for air or mop her brow	did she gasp for air or mop her brow
Now comes the pool flap	comes the pool flap
Only now is it undergoing a badly needed facelift	Only now is undergoing a badly needed facelift
Never once did she gasp for air or mop her brow	Never once did gasp for air or mop her brow
Nor does it cover the entire portfolio	Nor does cover the entire portfolio
Following are excerpts from the electronic traffic that night	Following are
Now comes the pool flap	Now comes
Only now is it undergoing a badly needed facelift	Only now is it
Never once did she gasp for air or mop her brow	Never once did she
Nor does it cover the entire portfolio	Nor does it
Following are excerpts from the electronic traffic that night	are excerpts from the electronic traffic that night
Now comes the pool flap	Now the pool flap
Bonds received a bigger boost later in the day when stock prices moved broadly lower	Bonds received a bigger boost later in the day stock prices moved broadly lower
It arrived just as the regulator handling such operations was retiring	It arrived as the regulator handling such operations was retiring
More people are remaining independent longer presumably because they are better off physically and financially	More people are remaining independent longer because they are better off physically and financially
The closely watched funds rate is what banks charge each other on overnight loans	The closely watched funds rate is banks charge each other on overnight loans
The reporters were victims and some of the victims turned into unofficial reporters	and some of the victims turned into unofficial reporters
The reporters were victims and some of the victims turned into unofficial reporters	The reporters were victims and
My back is still in knots and my hands are still shaking	and my hands are still shaking
My back is still in knots and my hands are still shaking	My back is still in knots and
Others had lesser damage and there were no injuries among workers	and there were no injuries among workers
Others had lesser damage and there were no injuries among workers	Others had lesser damage and
Two workers died and six remain in the hospital	and six remain in the hospital
Two workers died and six remain in the hospital	Two workers died and
Berkeley very quiet right now	Berkeley right now
Closed yesterday due to power difficulties	yesterday due to power difficulties
Too bad theory fails in practice	theory fails in practice
Too bad theory fails in practice	Too bad
Not so the Soviets	the Soviets
Not so the Soviets	Not so
Whether she can meet that ambitious goal is still far from certain	is still far from certain
All these reports about him committing genocide are probably exaggerated anyway	All these reports about are probably exaggerated anyway
Not to mention the incursion of imports	the incursion of imports
