demonstration	demon_label
The metaphor of theater is not entirely coincidental	is not entirely coincidental
It arrived just as the regulator handling such operations was retiring	arrived just as the regulator handling such operations was retiring
The fund made a similar move earlier this year	made a similar move earlier this year
He softened the talk about a recession	softened the talk about a recession
Corporate bonds were unchanged	were unchanged
He had been vice president in that office	had been vice president in that office
Wall Street is understandably skeptical	is understandably skeptical
The senators responded in kind	responded in kind
The ultimate hope is that the technique could identify diseased vessels	is that the technique could identify diseased vessels
That may soon change	may soon change
They currently have large orders for cargo planes	They currently
Her new line of work has some perils	Her new line of work
But observers expect broad support	But observers
The metaphor of theater is not entirely coincidental	The metaphor of theater
Not everyone believes that the good times are over for shippers	Not everyone
It has happened before	It
But some saw it as a classic negotiating tactic	But some
They speak volumes about the state of our society at a given moment	They
The post had been vacant for more than a year	The post
The battle for customer loyalty is evident along the Cobb Parkway strip	The battle for customer loyalty
The state of New Hampshire has favored that plan	The state of New Hampshire has
Help may be on the way	Help may
Analysts expect others to show a similar pattern	Analysts expect others to
Ski promotions have traditionally avoided the touchy issue of safety	Ski promotions have traditionally
She bursts into tears and walks away	She and walks away
Strategists should consider the impact of budget uncertainties at the beginning of the planning process	Strategists should
Three gambling casinos have opened in Poland	Three gambling casinos have
But Trelleborg still must clear some tough hurdles	But Trelleborg still must
Radio programs and books have followed the daily television show	Radio programs and books have
The Russians are talking peace	The Russians are
New telephone lines posted healthy growth	New telephone lines posted
Maybe it was their peculiar sense of history	Maybe it was
They did me some good	They did some good
The accord expired yesterday	The accord expired
It is also planning another night of original series	It is also planning
All along they have been noting the tremors and pointing out the underlying realities	All along they have been noting and pointing out the underlying realities
The two are also signing a trade agreement	The two are also signing
Conversation was subdued as most patrons watched the latest market statistics on television	Conversation was subdued as most patrons watched on television
Most expect the decline in New York stock prices to continue this week	Most expect the decline in New York stock prices to continue
It arrived just as the regulator handling such operations was retiring	It arrived just as the regulator handling was retiring
Lawmakers in both houses support the higher level	in both houses support the higher level
Both executives left the company after clashes with Chairman Ralph Ingersoll Jr	Both executives left the company after with Chairman Ralph Ingersoll Jr
But the lack of lines became painfully apparent	But of lines became painfully apparent
This is partly due to the particular demands of the crop	This is partly due to of the crop
Reasons for the collapse of the Nimitz Freeway were sketchy yesterday	Reasons for of the Nimitz Freeway were sketchy yesterday
The fallout for investors lately has been painful	for investors lately has been painful
The two sides also traded accusations about the cost of the Packwood plan	The two sides also traded accusations about of the Packwood plan
Our teachers are not an important factor in our educational crisis	Our teachers are not in our educational crisis
All of the bidders contemplate full payment including interest to secured creditors	All of the bidders contemplate including interest to secured creditors
The dispute pits two groups of claimants against each other	The dispute pits of claimants against each other
The infusion of activists can bring a clash of cultures	The infusion of activists can bring a clash
The charge on loans to brokers on stock exchange collateral	The charge on loans to brokers
Magazine publishers are facing spiraling costs and a glut of new titles	Magazine publishers are facing spiraling costs and a glut
The timing for change was right	The timing was right
Ski promotions have traditionally avoided the touchy issue of safety	Ski promotions have traditionally avoided the touchy issue
The above represents a triumph of either apathy or civility	The above represents a triumph
All of the bidders contemplate full payment including interest to secured creditors	All contemplate full payment including interest to secured creditors
Evidence of the growing Japanese demand for mortgage securities abounds	Evidence of the growing Japanese demand abounds
Both companies are regional carriers in the Southwest	Both companies are regional carriers
Craig Forman in London contributed to this article	Craig Forman contributed to this article
It is also planning another night of original series	It is also planning another night of
But the production is the equal of any local program	But the production is the equal of
Strong farmer selling over the weekend also weighed on prices	Strong farmer selling over also weighed on prices
Most of the loans in question are to Third World countries in South America	Most of are to Third World countries in South America
Conference committees are breeding grounds for mischief	Conference committees are breeding grounds for
The carriers were competing fiercely for market share	The carriers were competing fiercely for
Too bad theory fails in practice	Too bad theory fails in
And transfer control of much of it to Capitol Hill	And transfer control of much of to Capitol Hill
Then he would move his movement to Europe	Then he would move his movement to
That tariff is too stiff for some Financial District wage earners	That tariff is too stiff for
And most vacationers still prefer a warm climate for their winter excursions	And most vacationers still prefer a warm climate
Illinois Company Investments had been trimming its ranks until last summer	Illinois Company Investments had been trimming its ranks
The mask cuts to the quick	The mask cuts
The appeals court disagreed on both counts	The appeals court disagreed
Treasury bonds ended slightly higher in light trading	Treasury bonds ended slightly higher
Too bad theory fails in practice	Too bad theory fails
His interest in the natural environment dates from his youth	His interest in the natural environment dates
The great silver clouds on the horizon build themselves on the pale water	The great silver clouds on the horizon build themselves
Not everyone believes that the good times are over for shippers	Not everyone believes that the good times are over
Whether she can meet that ambitious goal is still far from certain	Whether she can meet that ambitious goal is still
Now a rocky stock market and weak corporate profits may further threaten the economy	a rocky stock market and weak corporate profits may further threaten the economy
The figures occasionally include incomplete transactions in restricted stock	The figures include incomplete transactions in restricted stock
The centers normally are closed through the weekend	The centers are closed through the weekend
Acting sometimes falls flat	Acting falls flat
The British government also strongly opposes the charter in its current form	The British government strongly opposes the charter in its current form
Other major players in intimate apparel apparently feel the same way	Other major players in intimate apparel feel the same way
Soon all hell broke loose	all hell broke loose
You already know the answer	You know the answer
But then the noise turned into a roar	But the noise turned into a roar
The dollar also declined	The dollar declined
The two executives could hardly be more different	The two executives could hardly be
And catastrophes are getting ever more costly	And catastrophes are getting
But this is not enough	But this is
Officials at Mellon Capital were unavailable for comment	Officials at Mellon Capital were
Other fund managers were similarly sanguine	Other fund managers were
This is just not so	This is just not
The switch to the London market during such turbulent times is significant	The switch to the London market during such turbulent times is
Since then she has become wealthy	Since then she has become
He wound up and let loose a fastball	He wound up and let a fastball
West German government officials and Western analysts are doubtful	West German government officials and Western analysts are
Business was slow because many companies were closed yesterday	Business was slow
The tape was on tv before the night was out	The tape was on tv
Japanese put up with it because the government provided job stability and growing paychecks	Japanese put up with it
But transportation officials worry that such extraordinary measures and cooperation may not last	But transportation officials worry
Not everyone believes that the good times are over for shippers	Not everyone believes
Nashua announced the Reiss request after the market closed	Nashua announced the Reiss request
Canadian investment rules require that big foreign takeovers meet that standard	Canadian investment rules require
But industry observers still questioned whether Georgia Pacific will ultimately prevail	But industry observers still questioned
Cray made its announcement after the stock market closed	Cray made its announcement
Surveys suggested that consumer confidence was high before Friday	Surveys suggested
The joke here is that the Giants lost by de fault	The joke here is that
The result is that the unthinkable and illogical are happening	The result is that
Nashua announced the Reiss request after the market closed	Nashua announced the Reiss request after
Not everyone believes that the good times are over for shippers	Not everyone believes that
The reality is that Bank finances are rock solid	The reality is that
Cray made its announcement after the stock market closed	Cray made its announcement after
The closely watched funds rate is what banks charge each other on overnight loans	The closely watched funds rate is what
The dollar posted gains in quiet trading as concerns about equities abated	The dollar posted gains in quiet trading as
Foreign bonds surged as the dollar weakened against most major currencies	Foreign bonds surged as
Integrated made its announcement after the market closed	Integrated made its announcement after
That went over the permissible line for warm and fuzzy feelings	That went over the permissible line for feelings
The Panamanian affair is only the tip of a more alarming iceberg	The Panamanian affair is only the tip of a iceberg
Some funds are posting yields far higher than the average	Some funds are posting yields
He is our most dangerous enemy	He is our enemy
Names are resigning at an even faster pace this year	Names are resigning at an pace this year
His humility gives him a much better chance of success	His humility gives him a chance of success
The most pressing problem was the suspension of options trading	The problem was the suspension of options trading
The guide scoops into a pail and puts a frantically wiggling croaker on the hook	The guide scoops into a pail and puts a croaker on the hook
The Northeast and West regions were unchanged	The regions were unchanged
But markets can operate with greater or lesser efficiency	But markets can operate with efficiency
The interviews took place two years ago	The interviews took place
And the number of stocks hitting new lows far outstrips the number setting new highs	And the number of stocks hitting new lows outstrips the number setting new highs
More people are remaining independent longer presumably because they are better off physically and financially	More people are remaining independent presumably because they are better off physically and financially
Treasury bonds ended slightly higher in light trading	Treasury bonds ended in light trading
This is just not so	This is not so
The house just settled right down into the ground	The house just settled into the ground
Stock prices fell sharply in active trading	Stock prices fell in active trading
The biggest flurry of investor activity came early in the day	The biggest flurry of investor activity came
And their suspicions of each other run deep	And their suspicions of each other run
No amount of hype will bring viewers back if the shows are weak	No amount of hype will bring viewers if the shows are weak
Not only Californians but all Americans would pay if this thing passed	Californians but all Americans would pay if this thing passed
Percentage differences based on daily sales rate rather than sales volume	Percentage differences based on daily sales rate sales volume
He has designed furniture and homes as well as commercial and office space	He has designed furniture and homes commercial and office space
Reynolds is the third big aluminum company since Friday to report disappointing earnings	Reynolds is the third big aluminum company to report disappointing earnings
By the end of the century scientists had embraced the system	scientists had embraced the system
Wall Street traders on Friday had complained about the trading suspensions	Wall Street traders had complained about the trading suspensions
In the end politics got in the way	politics got in the way
The New York company called the lawsuit without merit	The New York company called the lawsuit
In Greater Israel more than half the children under six are Muslims	more than half the children under six are Muslims
But under Alan Greenspan that has changed	But that has changed
Turkey in any event is long past it	Turkey is long past it
Strong farmer selling over the weekend also weighed on prices	Strong farmer selling also weighed on prices
For months the resistance has been defenseless against air attack	the resistance has been defenseless against air attack
Poverty remains far more widespread among blacks than other Americans	Poverty remains far more widespread among blacks
These securities are attractive to Japanese investors for three reasons	These securities are attractive for three reasons
But such skills were alien to Toni Johnson	But such skills were alien
Trading volume was only modestly higher than normal	Trading volume was only modestly higher
But some analysts remain sour on the company	But some analysts remain sour
Manufacturers Hanover had a loss due to a big reserve addition	Manufacturers Hanover had a loss due
For months the resistance has been defenseless against air attack	For months the resistance has been defenseless
None of these chief executives were available for comment	None of these chief executives were available
The agreement is subject to government approval	The agreement is subject
The merger is subject to regulatory clearance and a definitive agreement	The merger is subject
Prices of Treasury bonds tumbled in moderate to active trading	Prices of Treasury bonds tumbled in moderate to trading
Other analysts are nearly as pessimistic	Other analysts are nearly as
Whether she can meet that ambitious goal is still far from certain	Whether she can meet that ambitious goal is still far from
But a flurry of late trading yesterday beefed up prices	But a flurry of late trading yesterday beefed prices
British government bonds surged on renewed volatility in the stock market	British government bonds surged renewed volatility in the stock market
The robberies also have set off a controversy involving the airlines	The robberies also have set a controversy involving the airlines
It all adds up to a cold winter here	It all adds to a cold winter here
Then he casts out	Then he casts
Fund selling also picked up at that point	Fund selling also picked at that point
He takes over a school system in the midst of radical reform	He takes a school system in the midst of radical reform
Competition in the sale of complete bikes is heating up too	Competition in the sale of complete bikes is heating too
Even Drexel is pulling back	Even Drexel is pulling
Yet some funds have pulled in their horns	Yet some funds have pulled their horns
And not just for the players	And not for the players
Call at par after two years and thereafter at par every six months	Call at par after two years and at par every six months
Books and software everywhere	Books and software
Berkeley very quiet right now	Berkeley very quiet
And perhaps with good reason	And with good reason
And not just for the players	And not just
Call at par after two years and thereafter at par every six months	Call after two years and thereafter at par every six months
Call at par after two years and thereafter at par every six months	Call at par and thereafter at par every six months
Call at par after two years and thereafter at par every six months	Call at par after two years and thereafter every six months
And perhaps with good reason	And perhaps
Closed yesterday due to power difficulties	Closed yesterday
Analysts expect others to show a similar pattern	Analysts expect
He expects the price for that product to rise even more next year	He expects
He expects Citicorp to take a similar step this year	He expects
But many proponents of Filipino see resistance to the language finally crumbling	But many proponents of Filipino see
That announcement left union officials in Van Nuys and Oklahoma City uncertain about their futures	That announcement left
Most expect the decline in New York stock prices to continue this week	Most expect
It also found them rising much more in the Northeast than elsewhere	It also found
The new rules will allow investors to buy foreign stocks directly	The new rules will allow
Some would make even James Bond green with envy	Some would make
But slow sales forced Ford to kill the brand just last week	But slow sales forced
This occurred partly because of more competition as the number of new businesses surged	This occurred because of more competition as the number of new businesses surged
Other analysts are nearly as pessimistic	Other analysts are as pessimistic
Books and tapes all over my room	Books and tapes over my room
Revenue doubled from two years ago	Revenue doubled from
They note that stocks experienced volatile swings long before futures	They note that stocks experienced volatile swings before futures
We were coming down straight into their canal	We were coming down into their canal
An official linked the gain essentially to higher prices for beef and pork	An official linked the gain to higher prices for beef and pork
It also found them rising much more in the Northeast than elsewhere	It also found them rising much more in the Northeast than
The embryo had progressed only to a clump of eight identical cells	The embryo had progressed to a clump of eight identical cells
Our international efforts were far greater than ever before	Our international efforts were far greater than
Merchant banks were stronger across the board	Merchant banks were stronger across
He ticks off several major differences between now and two years ago	He ticks off several major differences between now and ago
But that was all of three months ago	But that was ago
It was all over the place	It was all over
He hit the lanes three years ago on the advice of his doctor	He hit the lanes ago on the advice of his doctor
The interviews took place two years ago	The interviews took place ago
The Senate will probably vote not long afterward	The Senate will probably vote afterward
Revenue doubled from two years ago	Revenue doubled from ago
It was down a little	It was down
But funds generally are better prepared this time around	But funds generally are better prepared around
Certainly not the lawyers	Certainly not
Not even an earthquake	Not even
Call at par after two years and thereafter at par every six months	at par after two years and thereafter at par every six months
Call at par after two years and thereafter at par every six months	Call at par after two years and thereafter at par
So two cheers for the new rules	So
Books and software everywhere	everywhere
Berkeley very quiet right now	very quiet right now
Closed yesterday due to power difficulties	Closed due to power difficulties
Not to mention the incursion of imports	Not to mention
And the practice often varies from location to location even within a company	And the practice often varies from location even within a company
The figures are at seasonally adjusted annual rates in trillions of dollars	The figures are at seasonally adjusted annual rates
Cadillac may be on to something	Cadillac may be on
The four lawyers climbed out from under a table	The four lawyers climbed out
The project has been in and out of the pipeline for more than a decade	The project has been in and out for more than a decade
The problem here is not in the concept but in its lack of discrimination	The problem here is not in the concept but
The Environmental Protection Agency is getting a lot out of the Superfund program	The Environmental Protection Agency is getting a lot out
The figures are at seasonally adjusted annual rates in trillions of dollars	The figures are in trillions of dollars
In Washington and on Wall Street	and on Wall Street
Details of credit enhancements vary widely from issue to issue	Details of credit enhancements vary widely to issue
Abortion via the pill is far more of an ordeal than conventional surgical abortion	Abortion via the pill is than conventional surgical abortion
The economic ideas in the document are much bolder than current policies	The economic ideas in the document are than current policies
But the device obscures more than it illuminates	But the device obscures than it illuminates
She was as cool as a cucumber	She was as a cucumber
Poverty remains far more widespread among blacks than other Americans	Poverty remains among blacks than other Americans
Some funds are posting yields far higher than the average	Some funds are posting yields than the average
Trading volume was only modestly higher than normal	Trading volume was than normal
Some would make even James Bond green with envy	Some would make even James Bond
Some economists found the mixture ominous	Some economists found the mixture
That announcement left union officials in Van Nuys and Oklahoma City uncertain about their futures	That announcement left union officials in Van Nuys and Oklahoma City
Those viewers find the show confusing	Those viewers find the show
Nerds and geeks sometimes find themselves a bit isolated at Harvard	Nerds and geeks sometimes find themselves at Harvard
Abbie lies back and leaves the frame empty	Abbie lies back and leaves the frame
Barbra Streisand made him famous	Barbra Streisand made him
The lack of any new cash probably would still leave the banks dissatisfied	The lack of any new cash probably would still leave the banks
The selling by money managers and individual investors is turning traders bearish as well	The selling by money managers and individual investors is turning traders as well
It also asked Mesa to keep the proposal confidential	It also asked Mesa to keep the proposal
Four of those insiders sold more than half their holdings	Four of those insiders sold their holdings
Michael Applebaum resigned after less than a year in the posts	Michael Applebaum resigned after year in the posts
He visits the same department every two or three weeks	He visits the same department weeks
The average recession lasts about a year	The average recession lasts year
Other gainers were companies with one or more undamaged California refineries	Other gainers were companies with undamaged California refineries
At least half that growth will have come in the past three years alone	that growth will have come in the past three years alone
He does this in at least three of his solo pieces	He does this in of his solo pieces
Estimated volume was five million ounces	Estimated volume was ounces
But that was all of three months ago	But that was months ago
The post had been vacant for more than a year	The post had been vacant for year
At least half that growth will have come in the past three years alone	At least half that growth will have come in the past three years
It all adds up to a cold winter here	It all adds up to a cold winter
But no one else does	But no one does
Blue chips led the march up in heavy trading	Blue chips led the march in heavy trading
Americans place native or native speakers in charge of subsidiaries overseas	Americans place native or native speakers in charge of subsidiaries
The issue here may be the soundness of the guarantee	The issue may be the soundness of the guarantee
Accepted theories of asset pricing offer a perfectly legitimate explanation	Accepted theories of asset pricing offer a explanation
But they will have disappointing returns or even losses if interest rates rise instead	But they will have disappointing returns or losses if interest rates rise instead
The joke here is that the Giants lost by de fault	The joke is that the Giants lost by de fault
Yet the state alone sells seeds and machines	Yet the state sells seeds and machines
And the number of stocks hitting new lows far outstrips the number setting new highs	And the number of stocks hitting new lows far outstrips the number
President Bush signed a disaster declaration covering seven Northern California counties	President Bush signed a disaster declaration
