demonstration	test_sentence	response
There is a lot of waste	But you know about campaign promises	But you know about.
But some money managers are doing just that	Strategists should consider the impact of budget uncertainties at the beginning of the planning process	Strategists should consider at the beginning of the 
But gripes run the gamut	Utilities management is a major commercial niche	Utilities management is a major.
The airline also named Mickey Foret as president	Chandler might have been predicting the course of his own career	Chandler might have been predicting the course.
The company also faces delisting by the National Association of Securities Dealers	The talks came as Lebanese negotiations on political changes appeared deadlocked	The talks came.
That brought a chain reaction in the industry	And his outlook improved after successful cataract surgery in August	And his outlook improved.
Colgate sold its hospital supply and home health care business last year	One man wrapped several diamonds in the knot of his tie	One man wrapped in the knot of his tie.
She expects both revenue and profit to gain this year	There is a small Renoir on the wall	There is a small Renoir.
The service supplies weekly reports on school and college construction plans	But Chairman Gonzalez is a genuine maverick	But chariman 
The pilots argued that this triggered a pay raise for them	Pension reform was its main thrust	none
Both figures were record highs	Not that oil suddenly is a sure thing again	Not that oil suddenly is.
But weak car sales raise questions about future demand from the auto sector	The loss of the cigarette account would be a severe blow to Wells Rich	The loss of the cigarette account would be.
The collapse of the span has provoked surprise and anger among state officials	Opponents show that there are already more funds available than commendable reform efforts	Opponents show.
Eventually viewers may grow bored with the technology and resent the cost	Compound yields assume reinvestment of dividends and that current yields continue for a year	Compound yields assume reinvestment of dividends and that current yields continue.
Miss Brady is deputy director of the Russian Research Foundation in London	All three funds posted negative returns for the year to date	All three funds posted negative returns for.
Accepted theories of asset pricing offer a perfectly legitimate explanation	The announcement fueled speculation for future advances in the shares	The announcement fueled speculation for.
Estimated volume was a very light one million ounces	Laurie McGinley contributed to this article	Laurie McGinley contributed.
Judges will write the real bill as suits roll through the courts	Silicon Valley heaved a sigh of relief yesterday	Silicon Valley heaved a sigh of relief.
But its stock jumped again yesterday as it disclosed surprisingly strong margins on those sales	The problem is not that the Fed is too unresponsive to the public interest	The problem is not that the Fed is too unresponsive to.
The measure also includes spending cuts and increases in federal fees	The journalistic consensus was that the earthquake made the World Series seem unimportant	The journalistic consensus was.
Both companies will replace the oil filler cap with a ventilated oil filler cap	Soaring rights fees will lead to an even greater clutter of commercials	Soaring rights fees will lead.
Advertisers attribute this shared loyalty to the striking similarity among brands	It also asked Mesa to keep the proposal confidential	It also asked Mesa to keep the proposal confidential.
These revised figures also may explain some of the recent strength of the dollar	But violation could bring substantial tax penalties to both employer and employees	But violation could bring.
Other money managers also opened their wallets	The dividend had been five cents a share	The dividend had been.
